{
  "id": "MK-005",
  "description": "tentýž cíl podruhé má stejné link_id a dostane tentýž token",
  "source": "<a href=\"https://track.mlain.invalid/c/2f1a9c40-0000-4000-8000-000000000001\">A</a><a href=\"https://track.mlain.invalid/c/2f1a9c40-0000-4000-8000-000000000001\">A znovu</a>",
  "tracking_domain": "https://t.example.cz",
  "link_tokens": { "2f1a9c40-0000-4000-8000-000000000001": "t1CLICK1" },
  "open_token": null,
  "expected": "<a href=\"https://t.example.cz/t/c/t1CLICK1\">A</a><a href=\"https://t.example.cz/t/c/t1CLICK1\">A znovu</a>",
  "expected_replacements": 2
}
