{
  "id": "MK-010",
  "description": "markup laděný pro Outlook zůstane bajtově beze změny mimo nahrazený úsek",
  "source": "<!--[if mso | IE]><table role=\"presentation\" border=\"0\" cellpadding=\"0\" cellspacing=\"0\"><tr><td style=\"line-height:0px;font-size:0px;mso-line-height-rule:exactly;\"><![endif]--><a href=\"https://track.mlain.invalid/c/2f1a9c40-0000-4000-8000-000000000004\">X</a><!--[if mso | IE]></td></tr></table><![endif]-->",
  "tracking_domain": "https://t.example.cz",
  "link_tokens": { "2f1a9c40-0000-4000-8000-000000000004": "t1CLICK4" },
  "open_token": null,
  "expected": "<!--[if mso | IE]><table role=\"presentation\" border=\"0\" cellpadding=\"0\" cellspacing=\"0\"><tr><td style=\"line-height:0px;font-size:0px;mso-line-height-rule:exactly;\"><![endif]--><a href=\"https://t.example.cz/t/c/t1CLICK4\">X</a><!--[if mso | IE]></td></tr></table><![endif]-->",
  "expected_replacements": 1
}
